{
 "format": "lefsim.model",
 "version": 2,
 "lattice": {
  "n_sites": 500,
  "ctcfs": [
   {
    "site": 25,
    "captures_from": "right",
    "strength": 0.7
   },
   {
    "site": 75,
    "captures_from": "left",
    "strength": 0.7
   },
   {
    "site": 125,
    "captures_from": "right",
    "strength": 0.7
   },
   {
    "site": 175,
    "captures_from": "left",
    "strength": 0.7
   },
   {
    "site": 225,
    "captures_from": "right",
    "strength": 0.7
   },
   {
    "site": 275,
    "captures_from": "left",
    "strength": 0.7
   },
   {
    "site": 325,
    "captures_from": "right",
    "strength": 0.7
   },
   {
    "site": 375,
    "captures_from": "left",
    "strength": 0.7
   },
   {
    "site": 425,
    "captures_from": "right",
    "strength": 0.7
   },
   {
    "site": 475,
    "captures_from": "left",
    "strength": 0.7
   }
  ]
 },
 "lefs": [
  {
   "left_pos": 335,
   "right_pos": 355,
   "left_mobility": "moving",
   "right_mobility": "moving"
  },
  {
   "left_pos": 250,
   "right_pos": 259,
   "left_mobility": "moving",
   "right_mobility": "moving"
  },
  {
   "left_pos": 427,
   "right_pos": 474,
   "left_mobility": "moving",
   "right_mobility": "moving"
  },
  {
   "left_pos": 25,
   "right_pos": 75,
   "left_mobility": "captured",
   "right_mobility": "captured"
  },
  {
   "left_pos": 27,
   "right_pos": 29,
   "left_mobility": "moving",
   "right_mobility": "moving"
  },
  {
   "left_pos": 5,
   "right_pos": 15,
   "left_mobility": "moving",
   "right_mobility": "moving"
  },
  {
   "left_pos": 59,
   "right_pos": 74,
   "left_mobility": "moving",
   "right_mobility": "moving"
  },
  {
   "left_pos": 329,
   "right_pos": 375,
   "left_mobility": "moving",
   "right_mobility": "captured"
  },
  {
   "left_pos": 425,
   "right_pos": 475,
   "left_mobility": "captured",
   "right_mobility": "captured"
  },
  {
   "left_pos": 330,
   "right_pos": 370,
   "left_mobility": "moving",
   "right_mobility": "moving"
  },
  {
   "left_pos": 325,
   "right_pos": 327,
   "left_mobility": "captured",
   "right_mobility": "moving"
  },
  {
   "left_pos": 392,
   "right_pos": 395,
   "left_mobility": "moving",
   "right_mobility": "moving"
  },
  {
   "left_pos": 26,
   "right_pos": 58,
   "left_mobility": "moving",
   "right_mobility": "moving"
  },
  {
   "left_pos": 226,
   "right_pos": 275,
   "left_mobility": "moving",
   "right_mobility": "captured"
  },
  {
   "left_pos": 237,
   "right_pos": 241,
   "left_mobility": "moving",
   "right_mobility": "moving"
  },
  {
   "left_pos": 277,
   "right_pos": 292,
   "left_mobility": "moving",
   "right_mobility": "moving"
  },
  {
   "left_pos": 349,
   "right_pos": 351,
   "left_mobility": "moving",
   "right_mobility": "moving"
  },
  {
   "left_pos": 443,
   "right_pos": 443,
   "left_mobility": "moving",
   "right_mobility": "moving"
  },
  {
   "left_pos": 125,
   "right_pos": 175,
   "left_mobility": "captured",
   "right_mobility": "captured"
  },
  {
   "left_pos": 225,
   "right_pos": 328,
   "left_mobility": "captured",
   "right_mobility": "moving"
  }
 ],
 "rates": {
  "step": 1.0,
  "respawn": 0.01,
  "respawn_blocked": 0.05,
  "respawn_captured": 0.002,
  "ctcf_on": null,
  "ctcf_off": null
 },
 "spawn": {
  "rule": "uniform_non_ctcf"
 }
}
